Symbol,Name,Last Sale,Net Change,% Change,Market Cap,Country,IPO Year,Volume,Sector,Industry
IDR,Idaho Strategic Resources Inc. Common Stock,$14.98,-0.26,-1.706%,204702569.00,United States,2022,210243,Basic Materials,Precious Metals
IGMS,IGM Biosciences Inc. Common Stock,$1.35,0.01,0.746%,80696793.00,United States,2019,84822,Health Care,Biotechnology: Pharmaceutical Preparations
IH,iHuman Inc. American depositary shares each representing five Class A ordinary shares,$2.27,0.01,0.442%,116953982.00,United States,2020,3113,Real Estate,Other Consumer Services
IHRT,iHeartMedia Inc. Class A Common Stock,$1.06,0.00,0.00%,156010153.00,United States,,448019,Consumer Discretionary,Broadcasting
III,Information Services Group Inc. Common Stock,$3.90,0.10,2.632%,188195081.00,United States,,79298,Consumer Discretionary,Professional Services
IKNA,Ikena Oncology Inc. Common Stock,$1.25,0.03,2.459%,60322639.00,United States,2021,43540,Health Care,Biotechnology: Biological Products (No Diagnostic Substances)
IKT,Inhibikase Therapeutics Inc. Common Stock,$2.25,0.01,0.446%,167268465.00,United States,2020,116487,Health Care,Biotechnology: Biological Products (No Diagnostic Substances)
ILLR,Triller Group Inc. Common Stock,$1.25,-0.10,-7.407%,193949771.00,United States,2019,303912,Finance,Investment Managers
ILPT,Industrial Logistics Properties Trust Common Shares of Beneficial Interest,$3.07,0.31,11.232%,203056370.00,United States,2018,591655,Real Estate,Real Estate Investment Trusts
IMMR,Immersion Corporation Common Stock,$7.41,0.14,1.926%,240057561.00,United States,1999,305812,Technology,Computer peripheral equipment
IMMX,Immix Biopharma Inc. Common Stock,$2.095,0.055,2.696%,58077816.00,United States,2021,59641,Health Care,Biotechnology: Pharmaceutical Preparations
IMUX,Immunic Inc. Common Stock,$1.15,-0.02,-1.709%,103673499.00,United States,2014,2161287,Health Care,Biotechnology: Pharmaceutical Preparations
INBK,First Internet Bancorp Common Stock,$22.04,0.83,3.913%,191683753.00,United States,,234908,Finance,Major Banks
INBKZ,First Internet Bancorp 6.0% Fixed-to-Floating Rate Subordinated Notes Due 2029,$24.0601,0.0501,0.209%,209252735.00,United States,,1616,Finance,Major Banks
INBX,Inhibrx Biosciences Inc. Common Stock,$12.15,-0.17,-1.38%,175882234.00,United States,,122946,Health Care,Biotechnology: Biological Products (No Diagnostic Substances)
INFU,InfuSystems Holdings Inc. Common Stock,$4.85,0.10,2.105%,101894698.00,United States,,67373,Health Care,Medical/Dental Instruments
INGN,Inogen Inc Common Stock,$7.20,0.14,1.983%,191012717.00,United States,2014,124221,Health Care,Industrial Specialties
INMB,INmune Bio Inc. Common stock,$7.76,0.17,2.24%,177939213.00,United States,2019,224791,Health Care,Biotechnology: Biological Products (No Diagnostic Substances)
INO,Inovio Pharmaceuticals Inc. Common Stock,$1.92,0.03,1.587%,70401064.00,United States,,434027,Health Care,Medical/Dental Instruments
INSE,Inspired Entertainment Inc. Common Stock,$7.54,0.23,3.146%,202862433.00,United States,2014,156850,Technology,Computer Software: Prepackaged Software
INSG,Inseego Corp. Common Stock,$8.24,0.01,0.122%,123652242.00,United States,,77517,Telecommunications,Telecommunications Equipment
INTT,inTest Corporation Common Stock,$5.96,-0.26,-4.18%,73744725.00,United States,1997,96844,Industrials,Electrical Products
INUV,Inuvo Inc.,$0.3901,-0.0044,-1.115%,55704518.00,United States,,423535,Consumer Discretionary,Advertising
INV,Innventure Inc. Common Stock,$3.96,-0.04,-1.00%,186540948.00,United States,,50828,Finance,Blank Checks
INVE,Identiv Inc. Common Stock,$3.34,0.00,0.00%,78559071.00,United States,,50608,Technology,Computer peripheral equipment
INZY,Inozyme Pharma Inc. Common Stock,$1.62,0.41,33.884%,104069121.00,United States,2020,8106744,Health Care,Biotechnology: Pharmaceutical Preparations
IOR,Income Opportunity Realty Investors Inc. Common Stock,$18.198,0.208,1.156%,73996307.00,United States,1987,104,Real Estate,Real Estate Investment Trusts
IRBT,iRobot Corporation Common Stock,$2.52,-0.06,-2.326%,77184034.00,United States,2005,1195233,Consumer Discretionary,Consumer Electronics/Appliances
IROQ,IF Bancorp Inc. Common Stock,$24.1501,0.00,0.00%,80939688.00,United States,2011,251,Finance,Savings Institutions
IRWD,Ironwood Pharmaceuticals Inc. Class A Common Stock,$0.9323,0.0204,2.237%,150854933.00,United States,2010,1977351,Health Care,Biotechnology: Pharmaceutical Preparations
ISPR,Ispire Technology Inc. Common Stock,$2.87,0.09,3.237%,163851090.00,United States,2023,25784,Health Care, Medicinal Chemicals and Botanical Products 
ISSC,Innovative Solutions and Support Inc. Common Stock,$7.10,0.17,2.453%,124571729.00,United States,2000,69446,Technology,EDP Services
ISTR,Investar Holding Corporation Common Stock,$19.35,0.43,2.273%,190125999.00,United States,2014,9702,Finance,Major Banks
ITOS,iTeos Therapeutics Inc. Common Stock,$7.77,0.27,3.60%,297387387.00,United States,2020,366462,Health Care,Biotechnology: Biological Products (No Diagnostic Substances)
IVVD,Invivyd Inc. Common Stock,$0.6284,0.0212,3.491%,75383772.00,United States,2021,693321,Health Care,Biotechnology: Biological Products (No Diagnostic Substances)
JAKK,JAKKS Pacific Inc. Common Stock,$18.74,0.32,1.737%,208880350.00,United States,1996,152905,Consumer Discretionary,Recreational Games/Products/Toys
JEQ,abrdn Japan Equity Fund Inc. Common Stock,$6.81,0.06,0.889%,92615932.00,United States,1992,32054,Consumer Discretionary,Air Freight/Delivery Services
JHI,John Hancock Investors Trust Common Stock,$13.26,0.07,0.531%,115952693.00,United States,,15114,Finance,Trusts Except Educational Religious and Charitable
JHS,John Hancock Income Securities Trust Common Stock,$11.2001,-0.0481,-0.428%,130442917.00,United States,,6116,Finance,Finance Companies
JILL,J. Jill Inc. Common Stock,$15.86,0.33,2.125%,241839719.00,United States,2017,123961,Consumer Discretionary,Apparel
JMSB,John Marshall Bancorp Inc. Common Stock,$17.47,0.47,2.765%,249391972.00,United States,,14802,Finance,Major Banks
JOUT,Johnson Outdoors Inc. Class A Common Stock,$24.64,0.92,3.879%,254618031.00,United States,,52614,Consumer Discretionary,Recreational Games/Products/Toys
JSPR,Jasper Therapeutics Inc. Common Stock,$5.41,0.03,0.558%,81269680.00,United States,2020,125888,Health Care,Biotechnology: Biological Products (No Diagnostic Substances)
JYNT,The Joint Corp. Common Stock,$10.495,0.155,1.499%,159260901.00,United States,2014,64255,Miscellaneous,Multi-Sector Companies
KEQU,Kewaunee Scientific Corporation Common Stock,$31.50,0.02,0.064%,89915616.00,United States,,27131,Industrials,Medical Specialities
KGEI,Kolibri Global Energy Inc. Common stock,$6.80,-0.07,-1.019%,243004562.00,United States,,53991,Energy,Oil & Gas Production
KIDZ,Classover Holdings Inc. Class B Common Stock,$7.18,1.82,33.955%,167138596.00,United States,,112863552,Real Estate,Other Consumer Services
KINS,Kingstone Companies Inc. Common Stock,$17.87,0.21,1.189%,245369432.00,United States,,218845,Finance,Property-Casualty Insurers
KLRS,Kalaris Therapeutics Inc. Common Stock,$5.83,-0.02,-0.342%,109035068.00,United States,2020,34836,Health Care,Biotechnology: Biological Products (No Diagnostic Substances)
KOD,Kodiak Sciences Inc Common Stock,$4.80,0.31,6.904%,253192046.00,United States,2018,615630,Health Care,Biotechnology: Biological Products (No Diagnostic Substances)
KOPN,Kopin Corporation Common Stock,$1.35,0.04,3.053%,218790450.00,United States,1992,1499734,Technology,Semiconductors
KPTI,Karyopharm Therapeutics Inc. Common Stock,$7.36,0.60,8.876%,61941789.00,United States,2013,120297,Health Care,Biotechnology: Pharmaceutical Preparations
KRMD,KORU Medical Systems Inc. Common Stock (DE),$2.85,0.10,3.636%,130977778.00,United States,,164289,Health Care,Medical/Dental Instruments
KRRO,Korro Bio Inc. Common Stock,$20.935,2.54,13.808%,196556663.00,United States,2019,115223,Health Care,Biotechnology: Pharmaceutical Preparations
KVHI,KVH Industries Inc. Common Stock,$5.00,-0.05,-0.99%,98820240.00,United States,1996,97272,Technology,Radio And Television Broadcasting And Communications Equipment
KYTX,Kyverna Therapeutics Inc. Common Stock,$2.28,0.06,2.703%,98530013.00,United States,2024,108808,Health Care,Biotechnology: Biological Products (No Diagnostic Substances)
LAKE,Lakeland Industries Inc. Common Stock,$16.84,0.01,0.059%,159956491.00,United States,1986,76781,Health Care,Industrial Specialties
LARK,Landmark Bancorp Inc. Common Stock,$30.54,0.73,2.449%,176590190.00,United States,,14743,Finance,Major Banks
LAW,CS Disco Inc. Common Stock,$3.70,0.09,2.493%,223418747.00,United States,2021,52002,Technology,Computer Software: Prepackaged Software
LAZR,Luminar Technologies Inc.  Class A Common Stock,$3.95,0.01,0.254%,167437328.00,United States,2019,1095035,Consumer Discretionary,Auto Parts:O.E.M.
LCNB,LCNB Corporation Common Stock,$14.94,0.42,2.893%,211519952.00,United States,,14134,Finance,Major Banks
LCTX,Lineage Cell Therapeutics Inc. Common Stock,$0.4907,-0.0133,-2.639%,112054432.00,United States,,444374,Health Care,Biotechnology: Biological Products (No Diagnostic Substances)
LCUT,Lifetime Brands Inc. Common Stock,$3.58,0.05,1.416%,79343107.00,United States,1991,56934,Consumer Discretionary,Industrial Machinery/Components
LE,Lands' End Inc. Common Stock,$8.58,0.12,1.418%,264962644.00,United States,,96695,Consumer Discretionary,Clothing/Shoe/Accessory Stores
LEE,Lee Enterprises Incorporated Common Stock,$8.23,-0.14,-1.673%,50951428.00,United States,,3770,Consumer Discretionary,Newspapers/Magazines
LESL,Leslie's Inc. Common Stock,$0.6267,-0.0002,-0.032%,116081982.00,United States,2020,2049344,Consumer Discretionary,Other Specialty Stores
LFCR,Lifecore Biomedical Inc. Common Stock,$7.29,0.46,6.735%,269914663.00,United States,,468883,Health Care,Biotechnology: Pharmaceutical Preparations
LFT,Lument Finance Trust Inc. Common Stock,$2.70,0.04,1.504%,141234864.00,United States,2013,91494,Real Estate,Real Estate Investment Trusts
LFVN,Lifevantage Corporation Common Stock (Delaware),$11.91,0.20,1.708%,149485757.00,United States,,204913,Health Care,Biotechnology: Pharmaceutical Preparations
LIEN,Chicago Atlantic BDC Inc. Common Stock,$10.4001,-0.0899,-0.857%,237334296.00,United States,2022,10761,Finance,Finance: Consumer Services
LINK,Interlink Electronics Inc. Common Stock,$6.10,0.067,1.111%,60171705.00,United States,,9151,Technology,Computer peripheral equipment
LMNR,Limoneira Co Common Stock,$15.88,0.35,2.254%,286557284.00,United States,,106595,Consumer Staples,Farming/Seeds/Milling
LNKB,LINKBANCORP Inc. Common Stock,$6.86,0.07,1.031%,256408566.00,United States,,31178,Finance,Major Banks
LNSR,LENSAR Inc. Common Stock,$13.96,-0.03,-0.214%,164581308.00,United States,,136249,Health Care,Medical/Dental Instruments
LOAN,Manhattan Bridge Capital Inc,$5.20,0.07,1.365%,59480985.00,United States,,30654,Real Estate,Real Estate Investment Trusts
LOCO,El Pollo Loco Holdings Inc. Common Stock,$9.08,-0.35,-3.712%,270377040.00,United States,2014,564137,Consumer Discretionary,Restaurants
LODE,Comstock Inc. Common Stock,$2.55,0.16,6.695%,61808055.00,United States,,484063,Industrials,Major Chemicals
LOGC,ContextLogic Inc. Class A Common Stock,$6.99,-0.06,-0.851%,183932197.00,United States,2020,234112,Consumer Discretionary,Catalog/Specialty Distribution
LOVE,The Lovesac Company Common Stock,$20.02,0.85,4.434%,296165950.00,United States,2018,219905,Consumer Discretionary,Other Specialty Stores
LPRO,Open Lending Corporation Common Stock,$1.34,0.06,4.688%,160509085.00,United States,,1918427,Finance,Finance: Consumer Services
LPSN,LivePerson Inc. Common Stock,$0.8874,0.029,3.378%,81032016.00,United States,2000,620400,Technology,Computer Software: Prepackaged Software
LPTH,LightPath Technologies Inc. Class A Common Stock,$2.49,0.15,6.41%,100000312.00,United States,1996,213499,Technology,Semiconductors
LRMR,Larimar Therapeutics Inc. Common Stock,$2.97,0.11,3.846%,190162839.00,United States,2014,2154588,Health Care,Biotechnology: Pharmaceutical Preparations
LSBK,Lake Shore Bancorp Inc. Common Stock,$14.86,0.00,0.00%,85193495.00,United States,2006,16,Finance,Savings Institutions
LSEA,Landsea Homes Corporation Common Stock,$6.19,0.24,4.034%,224884538.00,United States,2018,428664,Consumer Discretionary,Homebuilding
LTBR,Lightbridge Corporation Common Stock,$9.26,-0.08,-0.857%,188510922.00,United States,,673547,Consumer Discretionary,Professional Services
LTRX,Lantronix Inc. Common Stock,$2.25,0.07,3.211%,87276744.00,United States,2000,273561,Telecommunications,Computer Communications Equipment
LUCD,Lucid Diagnostics Inc. Common Stock,$1.285,-0.005,-0.388%,116618699.00,United States,2021,707360,Health Care,Medical/Dental Instruments
LUNG,Pulmonx Corporation Common Stock,$3.77,0.00,0.00%,150032503.00,United States,2020,902860,Health Care,Medical/Dental Instruments
LVO,LiveOne Inc. Common Stock,$0.7206,0.0031,0.432%,69244186.00,United States,,248600,Consumer Discretionary,Restaurants
LVWR,LiveWire Group Inc. Common Stock,$1.42,-0.12,-7.792%,288934135.00,United States,2022,66911,Consumer Discretionary,Motor Vehicles
LWLG,Lightwave Logic Inc. Common Stock,$0.8968,0.0148,1.678%,111920299.00,United States,,468360,Industrials,Containers/Packaging
LXEO,Lexeo Therapeutics Inc. Common Stock,$4.64,-0.07,-1.486%,154034066.00,United States,2023,1265442,Health Care,Biotechnology: Biological Products (No Diagnostic Substances)
LXRX,Lexicon Pharmaceuticals Inc. Common Stock,$0.6806,-0.0439,-6.059%,246031656.00,United States,,3530493,Health Care,Biotechnology: Pharmaceutical Preparations
LYEL,Lyell Immunopharma Inc. Common Stock,$0.4612,-0.0088,-1.872%,136159554.00,United States,2021,491707,Health Care,Biotechnology: Pharmaceutical Preparations
MAMA,Mama's Creations Inc. Common Stock,$6.68,-0.03,-0.447%,251141280.00,United States,,138226,Consumer Staples,Specialty Foods
MAMO,Massimo Group Common Stock,$2.28,-0.08,-3.39%,94726476.00,United States,2024,3541,Consumer Discretionary,Industrial Specialties
MAPS,WM Technology Inc. Class A Common Stock ,$1.26,0.00,0.00%,194478549.00,United States,2019,500757,Technology,Computer Software: Prepackaged Software
MASS,908 Devices Inc. Common Stock,$5.60,0.24,4.478%,197847961.00,United States,2020,303034,Industrials,Industrial Machinery/Components
MATV,Mativ Holdings Inc. Common Stock,$5.30,0.19,3.718%,288943322.00,United States,,350775,Basic Materials,Paper
MAYS,J. W. Mays Inc. Common Stock,$36.50,0.00,0.00%,73575970.00,United States,,169,Real Estate,Building operators
MBCN,Middlefield Banc Corp. Common Stock,$29.22,2.40,8.949%,236135644.00,United States,,8862,Finance,Major Banks
MBI,MBIA Inc. Common Stock,$4.83,0.18,3.871%,246190089.00,United States,1987,192824,Finance,Property-Casualty Insurers
MCFT,MasterCraft Boat Holdings Inc. Common Stock,$16.92,0.27,1.622%,283452503.00,United States,2015,81332,Industrials,Marine Transportation
MCHX,Marchex Inc. Class B Common Stock,$1.49,0.05,3.472%,65134203.00,United States,2004,10484,Consumer Discretionary,Business Services
MCR,MFS Charter Income Trust Common Stock,$6.23,0.035,0.565%,274172207.00,United States,1989,47123,Finance,Trusts Except Educational Religious and Charitable
MCRB,Seres Therapeutics Inc. Common Stock,$9.63,0.13,1.368%,83953743.00,United States,2015,66578,Health Care,Biotechnology: Pharmaceutical Preparations
MEC,Mayville Engineering Company Inc. Common Stock,$13.32,0.17,1.293%,271992042.00,United States,2019,39532,Industrials,Industrial Specialties
MED,MEDIFAST INC Common Stock,$13.25,0.27,2.08%,145631028.00,United States,,266317,Consumer Staples,Packaged Foods
MEI,Methode Electronics Inc. Common Stock,$6.68,0.30,4.702%,238414203.00,United States,,255938,Technology,Electrical Products
MFIN,Medallion Financial Corp. Common Stock,$9.09,0.23,2.596%,211452516.00,United States,,30907,Finance,Finance: Consumer Services
MFM,MFS Municipal Income Trust Common Stock,$5.21,0.00,0.00%,214587558.00,United States,1986,136168,Finance,Finance Companies
MG,Mistras Group Inc Common Stock,$9.39,0.23,2.511%,291390903.00,United States,2009,81300,Consumer Discretionary,Military/Government/Technical
MGF,MFS Government Markets Income Trust Common Stock,$3.11,-0.03,-0.955%,101377892.00,United States,1987,31263,Finance,Trusts Except Educational Religious and Charitable
MGNX,MacroGenics Inc. Common Stock,$1.75,0.07,4.167%,110408065.00,United States,2013,660531,Health Care,Biotechnology: Pharmaceutical Preparations
MGRM,Monogram Technologies Inc. Common Stock,$2.89,0.01,0.347%,101986493.00,United States,2023,35920,Health Care,Medical/Dental Instruments
MGX,Metagenomi Inc. Common Stock,$1.61,0.12,8.054%,60187390.00,United States,2024,369794,Health Care,Biotechnology: Biological Products (No Diagnostic Substances)
MGYR,Magyar Bancorp Inc. Common Stock,$14.35,0.24,1.701%,92982561.00,United States,2006,3419,Finance,Savings Institutions
MHH,Mastech Digital Inc Common Stock,$7.30,-0.22,-2.926%,85726032.00,United States,,11408,Consumer Discretionary,Professional Services
MIND,MIND Technology Inc. Common Stock (DE),$6.85,0.26,3.945%,54590534.00,United States,1994,126368,Industrials,Industrial Machinery/Components
MITT,AG Mortgage Investment Trust Inc. Common Stock,$6.65,0.12,1.838%,197231220.00,United States,2011,186597,Real Estate,Real Estate Investment Trusts
MKTW,MarketWise Inc. Class A Common Stock,$13.15,0.30,2.335%,214418022.00,United States,,13794,Technology,Computer Software: Prepackaged Software
MLSS,Milestone Scientific Inc. Common Stock,$1.09,0.01,0.926%,85433800.00,United States,2015,147471,Health Care,Industrial Specialties
MMLP,Martin Midstream Partners L.P. Limited Partnership,$3.05,0.19,6.643%,119118012.00,United States,2002,69594,Energy,Oil Refining/Marketing
MMT,MFS Multimarket Income Trust Common Stock,$4.61,0.00,0.00%,274517686.00,United States,1987,43681,Finance,Trusts Except Educational Religious and Charitable
MNOV,Medicinova Inc Common Stock,$1.51,0.04,2.721%,74059831.00,United States,,1435,Health Care,Biotechnology: Pharmaceutical Preparations
MNPR,Monopar Therapeutics Inc. Common Stock,$44.96,1.81,4.195%,274822181.00,United States,2019,15293,Health Care,Biotechnology: Pharmaceutical Preparations
MNSB,MainStreet Bancshares Inc. Common Stock,$19.61,0.70,3.702%,151548159.00,United States,,41112,Finance,Major Banks
MPAA,Motorcar Parts  of America Inc. Common Stock,$9.50,0.43,4.741%,186045255.00,United States,,154644,Consumer Discretionary,Auto Parts:O.E.M.
MPTI,M-tron Industries Inc. Common Stock,$58.44,1.13,1.972%,170128483.00,United States,2022,21949,Technology,Industrial Machinery/Components
MPV,Barings Participation Investors Common Stock,$17.10,-0.005,-0.029%,181289070.00,United States,1988,6345,Finance,Finance Companies
MPX,Marine Products Corporation Common Stock,$8.41,0.06,0.719%,293975276.00,United States,2001,31022,Industrials,Marine Transportation
MRAM,Everspin Technologies Inc. Common Stock,$5.78,-0.14,-2.365%,129861838.00,United States,2016,57431,Technology,Semiconductors
MRBK,Meridian Corporation Common Stock,$13.63,0.35,2.636%,153818339.00,United States,2017,45388,Finance,Major Banks
MRCC,Monroe Capital Corporation Common Stock,$7.02,0.16,2.332%,152097707.00,United States,2012,62389,Finance,Investment Managers
MTW,Manitowoc Company Inc. (The) Common Stock,$8.50,0.36,4.423%,298641083.00,United States,,378577,Industrials,Construction/Ag Equipment/Trucks
MVBF,MVB Financial Corp. Common Stock,$17.87,0.38,2.173%,231394967.00,United States,,9202,Finance,Major Banks
MVIS,MicroVision Inc. Common Stock,$1.10,0.01,0.917%,269505264.00,United States,1996,2148689,Technology,Industrial Machinery/Components
MVO,MV Oil Trust Units of Beneficial Interests,$5.75,-0.11,-1.877%,66125000.00,United States,2007,125712,Energy,Oil & Gas Production
MVSTW,Microvast Holdings Inc. Warrants,$0.1903,-0.013,-6.394%,61887289.00,United States,2019,124108,Miscellaneous,Industrial Machinery/Components
MWYN,Marwynn Holdings Inc. Common stock,$3.05,0.01,0.329%,52014712.00,United States,2025,188364,Consumer Discretionary,Food Distributors
MXCT,MaxCyte Inc. Common Stock,$2.82,0.03,1.075%,299804685.00,United States,2021,243156,Health Care,Biotechnology: Commercial Physical & Biological Resarch
MYFW,First Western Financial Inc. Common Stock,$21.75,0.86,4.117%,211071157.00,United States,2018,28281,Finance,Major Banks
MYO,Myomo Inc. Common Stock,$4.88,0.14,2.954%,167779890.00,United States,2017,336062,Health Care,Industrial Specialties
MYPS,PLAYSTUDIOS Inc.  Class A Common Stock,$1.35,0.07,5.469%,180178393.00,United States,2020,116363,Technology,Computer Software: Prepackaged Software
NATR,Nature's Sunshine Products Inc. Common Stock,$12.49,0.21,1.71%,230858927.00,United States,,21119,Health Care,Biotechnology: Pharmaceutical Preparations
NAUT,Nautilus Biotechnolgy Inc. Common Stock,$0.6774,-0.0075,-1.095%,85452973.00,United States,2020,176676,Industrials,Biotechnology: Laboratory Analytical Instruments
NB,NioCorp Developments Ltd. Common Stock,$2.31,-0.05,-2.119%,87525900.00,United States,,783653,Basic Materials,Metal Mining
NC,NACCO Industries Inc. Common Stock,$34.58,1.12,3.347%,257348855.00,United States,,15856,Energy,Coal Mining
NCIQ,Hashdex Nasdaq Crypto Index US ETF,$24.1242,0.0888,0.369%,103734060.00,United States,,1155,,
NCSM,NCS Multistage Holdings Inc. Common Stock,$34.32,0.29,0.852%,87201938.00,United States,2017,6677,Energy,Oilfield Services/Equipment
NEN,New England Realty Associates Limited Partnership Class A Depositary Receipts Evidencing Units of Limited Partnership,$78.107,0.00,0.00%,220442480.00,United States,,140,Real Estate,Building operators
NEOV,NeoVolta Inc. Common Stock,$3.42,-0.14,-3.933%,114286561.00,United States,,459022,Miscellaneous,Industrial Machinery/Components
NEOVW,NeoVolta Inc. Warrant,$1.4999,-0.0001,-0.007%,50122343.00,United States,,2681,Miscellaneous,Industrial Machinery/Components
NEUE,NeueHealth Inc. Common Stock,$6.77,-0.01,-0.147%,58592712.00,United States,2021,10258,Health Care,Medical Specialities
NEWT,NewtekOne Inc. Common Stock,$10.58,0.05,0.475%,278155267.00,United States,,324751,Finance,Major Banks
NGS,Natural Gas Services Group Inc. Common Stock,$19.06,0.72,3.926%,238374309.00,United States,2002,35169,Energy,Oilfield Services/Equipment
NHTC,Natural Health Trends Corp. Common Stock,$5.01,0.05,1.008%,57680506.00,United States,,13065,Consumer Discretionary,Consumer Specialties
NKSH,National Bankshares Inc. Common Stock,$25.99,0.97,3.877%,165384012.00,United States,,15112,Finance,Major Banks
NKTR,Nektar Therapeutics  Common Stock,$0.752,-0.0281,-3.602%,139949898.00,United States,,1399871,Health Care,Biotechnology: Pharmaceutical Preparations
NKTX,Nkarta Inc. Common Stock,$2.09,0.04,1.951%,148301288.00,United States,2020,353339,Health Care,Biotechnology: Pharmaceutical Preparations
NMRA,Neumora Therapeutics Inc. Common Stock,$0.7762,0.0048,0.622%,125728040.00,United States,2023,878776,Health Care,Biotechnology: Biological Products (No Diagnostic Substances)
NNBR,NN Inc. Common Stock,$2.01,0.11,5.789%,100272593.00,United States,1994,144399,Industrials,Industrial Machinery/Components
NODK,NI Holdings Inc. Common Stock,$12.91,0.28,2.217%,266998759.00,United States,2017,6016,Finance,Property-Casualty Insurers
NOTE,FiscalNote Holdings Inc. Class A common stock,$0.6511,0.0312,5.033%,105100736.00,United States,2022,1244651,Consumer Discretionary,Business Services
NOTV,Inotiv Inc. Common Stock,$2.03,0.05,2.525%,68754616.00,United States,,339695,Health Care,Biotechnology: Commercial Physical & Biological Resarch
NRC,National Research Corporation Common Stock (Delaware),$12.77,0.655,5.407%,293014444.00,United States,,97269,Health Care,Biotechnology: Commercial Physical & Biological Resarch
NREF,NexPoint Real Estate Finance Inc. Common Stock,$14.56,0.26,1.818%,256889739.00,United States,2020,25154,Real Estate,Real Estate Investment Trusts
NRGV,Energy Vault Holdings Inc. Common Stock,$0.7188,0.0238,3.424%,110869825.00,United States,2021,655761,Miscellaneous,Industrial Machinery/Components
NSTS,NSTS Bancorp Inc. Common Stock,$11.52,0.00,0.00%,60454956.00,United States,2022,818,Finance,Savings Institutions
NTHI,NeOnc Technologies Holdings Inc. Common Stock,$5.36,0.00,0.00%,100477836.00,United States,,249594,Health Care,Biotechnology: Pharmaceutical Preparations
NTIC,Northern Technologies International Corporation Common Stock,$7.26,-0.01,-0.138%,68783875.00,United States,,11660,Industrials,Industrial Specialties
NTRB,Nutriband Inc. Common Stock,$6.37,0.07,1.111%,71052069.00,United States,,47242,Health Care,Industrial Specialties
NVCT,Nuvectis Pharma Inc. Common Stock,$9.25,-0.37,-3.846%,216371366.00,United States,2022,106145,Health Care,Biotechnology: Pharmaceutical Preparations
NVNO,enVVeno Medical Corporation Common Stock,$3.55,0.24,7.251%,62252800.00,United States,2018,199832,Health Care,Medical/Dental Instruments
NWFL,Norwood Financial Corp. Common Stock,$26.90,0.99,3.821%,249163725.00,United States,,25341,Finance,Major Banks
NXC,Nuveen California Select Tax-Free Income Portfolio Common Stock,$12.92,-0.1164,-0.893%,82182608.00,United States,1992,23982,Finance,Investment Managers
NXDT,NexPoint Diversified Real Estate Trust Common Stock,$3.65,0.12,3.399%,162487097.00,United States,,94801,Real Estate,Real Estate Investment Trusts
OABI,OmniAb Inc. Common Stock,$1.75,-0.02,-1.13%,213736147.00,United States,2021,679157,Health Care,Biotechnology: Commercial Physical & Biological Resarch
OBIO,Orchestra BioMed Holdings Inc. Ordinary Shares,$2.74,-0.01,-0.364%,104976283.00,United States,2020,247801,Health Care, Medicinal Chemicals and Botanical Products 
OCCI,OFS Credit Company Inc. Common Stock,$6.78,0.10,1.497%,78759938.00,United States,2018,252832,Finance,Trusts Except Educational Religious and Charitable
